{
  "description": "#35 d29/d30, #39: puts a PR fix request in the fixer queue with the built-in queue.add and answers its place in line. With vars.fixer_levels the request goes to the queue of the level its try is due at (try n: the n-th enabled level; queues/pr-fixer is level 1's), so a retry goes to its next level's queue. A PR already waiting keeps its place: the newer request replaces its head and instruction (across the level queues: one waiting request per PR). A retry (a try that did not pass) joins at the back; one whose PR spent its 3 attempts fails, so the rule hands back. Non-agentic: no actor, no GitHub call.",
  "edges": [
    {
      "source": "inputs",
      "source_port": "repo",
      "target": "enqueue",
      "target_port": "repo"
    },
    {
      "source": "inputs",
      "source_port": "number",
      "target": "enqueue",
      "target_port": "number"
    },
    {
      "source": "inputs",
      "source_port": "head_sha",
      "target": "enqueue",
      "target_port": "head_sha"
    },
    {
      "source": "inputs",
      "source_port": "head_branch",
      "target": "enqueue",
      "target_port": "head_branch"
    },
    {
      "source": "inputs",
      "source_port": "base_sha",
      "target": "enqueue",
      "target_port": "base_sha"
    },
    {
      "source": "inputs",
      "source_port": "clone_url",
      "target": "enqueue",
      "target_port": "clone_url"
    },
    {
      "source": "inputs",
      "source_port": "instruction",
      "target": "enqueue",
      "target_port": "instruction"
    },
    {
      "source": "inputs",
      "source_port": "task",
      "target": "enqueue",
      "target_port": "task"
    },
    {
      "source": "inputs",
      "source_port": "prior_instruction",
      "target": "enqueue",
      "target_port": "prior_instruction"
    },
    {
      "source": "inputs",
      "source_port": "retry",
      "target": "enqueue",
      "target_port": "retry"
    },
    {
      "source": "inputs",
      "source_port": "checks_conclusion",
      "target": "enqueue",
      "target_port": "checks_conclusion"
    }
  ],
  "enabled": true,
  "id": "queue-add",
  "inputs": [
    {
      "description": "owner/name",
      "name": "repo",
      "required": false,
      "type": "string"
    },
    {
      "description": "",
      "name": "number",
      "required": false,
      "type": "integer"
    },
    {
      "description": "the PR head the request is for",
      "name": "head_sha",
      "required": false,
      "type": "string"
    },
    {
      "description": "",
      "name": "head_branch",
      "required": false,
      "type": "string"
    },
    {
      "description": "",
      "name": "base_sha",
      "required": false,
      "type": "string"
    },
    {
      "description": "",
      "name": "clone_url",
      "required": false,
      "type": "string"
    },
    {
      "description": "what the agent is asked to do",
      "name": "instruction",
      "required": false,
      "type": "string"
    },
    {
      "description": "the original task, for a retry",
      "name": "task",
      "required": false,
      "type": "string"
    },
    {
      "description": "a retry's last instruction (its task when task is empty)",
      "name": "prior_instruction",
      "required": false,
      "type": "string"
    },
    {
      "description": "a try that did not pass, re-entering at the back (d30)",
      "name": "retry",
      "required": false,
      "type": "boolean"
    },
    {
      "description": "d38: the checks settle's conclusion (pr-fixer-checks); a timeout's checks are read again at dispatch",
      "name": "checks_conclusion",
      "required": false,
      "type": "string"
    }
  ],
  "name": "Add to the fixer queue",
  "outputs": [
    {
      "name": "queued",
      "source": "steps.enqueue.outputs.queued",
      "type": "boolean"
    },
    {
      "name": "replaced",
      "source": "steps.enqueue.outputs.replaced",
      "type": "boolean"
    },
    {
      "name": "key",
      "source": "steps.enqueue.outputs.key",
      "type": "string"
    },
    {
      "name": "position",
      "source": "steps.enqueue.outputs.position",
      "type": "integer"
    },
    {
      "name": "ahead",
      "source": "steps.enqueue.outputs.ahead",
      "type": "string"
    },
    {
      "name": "length",
      "source": "steps.enqueue.outputs.length",
      "type": "integer"
    },
    {
      "name": "attempt",
      "source": "steps.enqueue.outputs.attempt",
      "type": "integer"
    },
    {
      "name": "queue",
      "source": "steps.enqueue.outputs.queue",
      "type": "string"
    }
  ],
  "schema_version": "1.0",
  "steps": [
    {
      "body": [],
      "config": {
        "builtin": "queue.add",
        "key_prefix": "pr-fixer:",
        "levels": "fixer_levels",
        "queue": "pr-fixer"
      },
      "description": "The built-in queue.add: appends the request by compare-and-set (first come, first served across nodes) to the queue of its try's level in vars.fixer_levels (queues/pr-fixer without levels), or refreshes the PR's waiting request in place.",
      "enabled": true,
      "id": "enqueue",
      "inputs": [
        {
          "description": "",
          "name": "repo",
          "required": true,
          "type": "string"
        },
        {
          "description": "",
          "name": "number",
          "required": true,
          "type": "integer"
        },
        {
          "description": "",
          "name": "head_sha",
          "required": false,
          "type": "string"
        },
        {
          "description": "",
          "name": "head_branch",
          "required": false,
          "type": "string"
        },
        {
          "description": "",
          "name": "base_sha",
          "required": false,
          "type": "string"
        },
        {
          "description": "",
          "name": "clone_url",
          "required": false,
          "type": "string"
        },
        {
          "description": "",
          "name": "instruction",
          "required": false,
          "type": "string"
        },
        {
          "description": "",
          "name": "task",
          "required": false,
          "type": "string"
        },
        {
          "description": "",
          "name": "prior_instruction",
          "required": false,
          "type": "string"
        },
        {
          "description": "",
          "name": "retry",
          "required": false,
          "type": "boolean"
        },
        {
          "description": "",
          "name": "checks_conclusion",
          "required": false,
          "type": "string"
        }
      ],
      "kind": "code",
      "max_iterations": null,
      "name": "Add to the queue",
      "outputs": [
        {
          "description": "",
          "name": "queued",
          "required": true,
          "type": "boolean"
        },
        {
          "description": "",
          "name": "replaced",
          "required": true,
          "type": "boolean"
        },
        {
          "description": "",
          "name": "key",
          "required": true,
          "type": "string"
        },
        {
          "description": "",
          "name": "position",
          "required": false,
          "type": "integer"
        },
        {
          "description": "",
          "name": "ahead",
          "required": false,
          "type": "string"
        },
        {
          "description": "",
          "name": "length",
          "required": true,
          "type": "integer"
        },
        {
          "description": "",
          "name": "attempt",
          "required": false,
          "type": "integer"
        },
        {
          "description": "",
          "name": "queue",
          "required": false,
          "type": "string"
        }
      ],
      "placement": null,
      "retry": null,
      "timeout_s": 60.0
    }
  ],
  "variables": [],
  "version": 1
}
