{
  "description": "d25: the GitGuardian findings of a PR head as one comment: each finding's secret type, file and line, commit and incident, never a secret value. A failed GitGuardian check is never auto-fixed.",
  "edges": [
    {
      "source": "inputs",
      "source_port": "repo",
      "target": "findings",
      "target_port": "repo"
    },
    {
      "source": "inputs",
      "source_port": "head_sha",
      "target": "findings",
      "target_port": "head_sha"
    }
  ],
  "enabled": true,
  "id": "report-secrets",
  "inputs": [
    {
      "description": "owner/name",
      "name": "repo",
      "required": false,
      "type": "string"
    },
    {
      "description": "the PR head GitGuardian scanned",
      "name": "head_sha",
      "required": false,
      "type": "string"
    }
  ],
  "name": "Report GitGuardian findings",
  "notes": "",
  "outputs": [
    {
      "name": "comment",
      "source": "steps.findings.outputs.comment",
      "type": "string"
    },
    {
      "name": "state",
      "source": "steps.findings.outputs.state",
      "type": "string"
    },
    {
      "name": "total",
      "source": "steps.findings.outputs.total",
      "type": "integer"
    },
    {
      "name": "findings",
      "source": "steps.findings.outputs.findings",
      "type": "array"
    }
  ],
  "schema_version": "1.0",
  "steps": [
    {
      "body": [],
      "config": {
        "actor": "github-app",
        "builtin": "gitguardian.findings"
      },
      "description": "The built-in gitguardian.findings: reads the GitGuardian check of the head as the App and parses its findings table (type, file, line, commit, incident; at most 50) into the comment. Fails on a lookup error.",
      "enabled": true,
      "id": "findings",
      "inputs": [
        {
          "description": "",
          "name": "repo",
          "required": true,
          "type": "string"
        },
        {
          "description": "",
          "name": "head_sha",
          "required": true,
          "type": "string"
        }
      ],
      "kind": "code",
      "max_iterations": null,
      "name": "GitGuardian findings",
      "notes": "",
      "outputs": [
        {
          "description": "",
          "name": "state",
          "required": true,
          "type": "string"
        },
        {
          "description": "",
          "name": "findings",
          "required": true,
          "type": "array"
        },
        {
          "description": "",
          "name": "total",
          "required": false,
          "type": "integer"
        },
        {
          "description": "",
          "name": "omitted",
          "required": false,
          "type": "integer"
        },
        {
          "description": "",
          "name": "truncated",
          "required": false,
          "type": "boolean"
        },
        {
          "description": "",
          "name": "check_url",
          "required": false,
          "type": "string"
        },
        {
          "description": "",
          "name": "comment",
          "required": true,
          "type": "string"
        }
      ],
      "placement": {
        "actor": "github-app",
        "machine": null,
        "requirement": null
      },
      "retry": null,
      "timeout_s": 60.0
    }
  ],
  "variables": [],
  "version": 1
}
